{
  "$schema": "../schemas/config.schema.json",
  "reviewer": "sys1",
  "sys1_provider": "openrouter",
  "sys1_model": "typesafe/jev-1.13",
  "sys1_escalate_threshold": 0.6,
  "sys2_provider": "openai-codex",
  "sys2_model": "codex-auto-review",
  "sys2_reasoning": "low",
  "timeoutMs": 30000,
  "rules": {
    "allow": {
      "commands": [
        "pwd",
        "git status",
        "git diff",
        "git diff *",
        "git log",
        "git log *",
        "git show",
        "git show *",
        "git rev-parse *",
        "git ls-files",
        "git ls-files *",
        "npm test",
        "npm test *",
        "npm run typecheck",
        "npm run build",
        "npm run lint"
      ],
      "paths": [
        "$CWD",
        "/tmp",
        "~/tmp",
        "~/.richie",
        "~/.pi",
        "~/warchives"
      ]
    },
    "block": {
      "commands": [
        "sudo",
        "sudo *",
        "rm -rf /",
        "rm -rf /*",
        "git push --force",
        "git push --force *",
        "git push -f",
        "git push -f *",
        "git reset --hard",
        "git reset --hard *",
        "git clean -f",
        "git clean -f *"
      ],
      "paths": []
    }
  }
}
